Ticker,Agent_Confidence,Agent_Rating,Agent_Recommendation,Analysis_Date,Devils_Advocate_Analysis,Domains_Used,Evidence_Total,Evidence_Used,Justification,Market_Investor_Analysis,Quant_Score,Value_Investor_Analysis
GEV,0.5,0.25,Sell,2025-08-27,"As of 2025-08-27, GE Vernova Inc. (GEV) presents a compelling case for skepticism, despite its strategic position in the energy transition. The most glaring red flag is its astronomical valuation: a trailing P/E ratio of 150.70 and a forward P/E of 90.20, alongside an EV/EBITDA of 68.22, indicate that the market has priced in an extraordinary, perhaps unrealistic, level of future growth and profitability. This is further underscored by the stock's dramatic surge, trading near its 52-week high of $677.29 (CNBC, 07/31/25) after climbing from a 52-week low of $180.77 (CNBC, 08/27/24).

Financially, the company carries an exceptionally high debt-to-equity ratio of 10.646, which signals significant financial leverage and potential risk, despite a positive operating cash flow of $2.583 billion and free cash flow of $3.578 billion. The absence of a reported capital expenditures figure makes it difficult to fully assess the quality and sustainability of that free cash flow. While the company reported a net income of $1.6 billion for the full year 2024 (gevernova.com, *older than 12 months*), this still translates to a P/E ratio well over 100 against its current $169.43 billion market capitalization, reinforcing the extreme forward-looking premium.

Recent news, such as the acquisition of Alteia to enhance AI tools (Reuters, 07/21/25) and a maintenance order from Rio Tinto (Yahoo Finance, 07/09/25), are positive operational developments, but they appear incremental rather than transformative enough to justify the current valuation. Furthermore, while some analysts like Morgan Stanley were bullish in September 2024 (Yahoo Finance, *older than 12 months*), and Jim Cramer recently expressed his liking for the stock (CNBC, 08/27/25), the increasing short interest, up 5.75% from the previous month to 6.80 million shares (MarketBeat, 07/31/25), suggests a growing segment of investors are betting against the stock at these elevated levels.

In conclusion, GE Vernova's current market valuation appears detached from its fundamental financial metrics, suggesting an over-optimistic outlook that leaves little margin for error and significant downside potential.","bloomberg.com, cnbc.com, finance.yahoo.com, ge.com, gevernova.com, marketbeat.com, reuters.com, seekingalpha.com, wsj.com",28,18,"GE Vernova Inc. (GEV) is significantly overvalued, trading near its 52-week high with astronomical valuation multiples (P/E 150.70, Fwd P/E 90.20, EV/EBITDA 68.22). The company also carries an exceptionally high debt-to-equity ratio of 10.646, posing substantial financial risk. While GEV benefits from a strong market position in energy transition and robust cash flow, these positives are heavily outweighed by the extreme valuation, lack of margin of safety, and increasing short interest, indicating significant downside potential.","As a Market Investor, I'm looking at GE Vernova Inc. (GEV) today, 2025-08-27, with a mix of optimism for its market position and caution regarding its valuation.

GE Vernova, an Industrials sector company with a market capitalization of $169.43 billion, was spun off from GE on April 2, 2024 (ge.com, Feb 29, 2024 - *older than 12 months*), positioning itself as a leader in the energy transition. The stock is currently trading at $622.39, near its 52-week high of $677.29, and has seen an impressive 89.22% year-to-date change (CNBC, Yahoo Finance).

From a fundamental perspective, GEV's valuation metrics are exceptionally high, suggesting significant market expectations for future growth. Its trailing P/E stands at 150.70, with a forward P/E of 90.20, a price-to-book ratio of 19.09, and an EV/EBITDA of 68.22. While these indicate a premium, the company demonstrates strong cash generation with an operating cash flow of $2.583 billion and free cash flow of $3.578 billion. Capital expenditures are N/A. However, the debt-to-equity ratio is notably high at 10.646, which is a point of concern for leverage. The dividend yield is a modest 0.16%. Beta is N/A.

Recent news highlights GEV's strategic moves and positive sentiment. On July 21, 2025, Reuters reported GE Vernova's acquisition of France's Alteia, aimed at enhancing AI tools for utilities, signaling a commitment to technological advancement. The company also secured a maintenance order from Rio Tinto for hydropower plant upgrades on July 9, 2025 (finance.yahoo.com), underscoring its role in modernizing critical energy infrastructure. Analyst sentiment has been largely positive, with Morgan Stanley including GEV in its ""Best Stock Picks for 2025"" (finance.yahoo.com, Sep 16, 2024 - *older than 12 months*) and Jim Cramer expressing a liking for the stock (CNBC, Aug 27, 2025). Seeking Alpha also published a ""Strong Buy"" article on May 27, 2025, citing potential tailwinds from AI data center growth.

Despite the bullish outlook, some caution is warranted. A Seeking Alpha article from January 14, 2025, raised concerns about the stock being ""Overpriced With Too Many Problems To Ignore."" Furthermore, short interest has seen a 5.75% increase to 6.80 million shares as of July 31, 2025, representing 2.50% of the float with a 2.3 days to cover ratio (marketbeat.com), indicating a segment of the market believes the stock is overvalued.

GE Vernova is a high-growth, high-valuation play in the critical energy transition sector, demonstrating strong operational cash flow and strategic expansion, but its elevated debt and valuation multiples necessitate careful monitoring for long-term sustainability.",0.7710541234532577,"As a Value Investor, my assessment of GE Vernova Inc. (GEV) on 2025-08-27 focuses on its intrinsic value, financial health, and the margin of safety offered at its current price.

GE Vernova, an industrial company focused on the energy transition, has seen considerable market attention since its spin-off from General Electric on April 2, 2024 (ge.com, *older*). The stock currently trades at $622.39, near its 52-week high of $677.29 (reached on 07/31/25), and significantly above its 52-week low of $180.77 (on 08/27/24). This substantial price appreciation, with a YTD change of 89.22% (CNBC), immediately raises questions about its current valuation from a value perspective.

From a valuation standpoint, the company's metrics are exceptionally high. The trailing P/E ratio stands at 150.70, and the forward P/E is 90.20. The price-to-book ratio is also elevated at 19.09, and the EV/EBITDA is 68.22. These figures suggest that the market has priced in substantial future growth, leaving little to no margin of safety for a value-oriented investor. While analysts like Morgan Stanley have included GEV in their ""Best Stock Picks for 2025"" (finance.yahoo.com, September 16, 2024 - *older*), and Jim Cramer has expressed a liking for the stock (CNBC, August 27, 2025), such high multiples typically indicate an overvalued equity, regardless of growth prospects. Indeed, some sentiment, as seen on Seeking Alpha (January 14, 2025 - *older*), suggests the stock is ""Overpriced With Too Many Problems To Ignore.""

Examining the company's financial health, GE Vernova reports a market capitalization of $169.43 billion. Its debt-to-equity ratio is 10.646, which is a significant level of leverage that warrants careful consideration for long-term stability. On the positive side, the company demonstrates strong cash generation, with operating cash flow at $2.583 billion and free cash flow at $3.578 billion. Capital Expenditures is N/A from the provided data. The dividend yield is a modest 0.16%. Recent financial reports show Q2 2025 revenue of $9.111 billion (Bloomberg). Earlier, Q3 2024 saw total orders of $9.4 billion (+17% organically) and revenue of $8.9 billion (+8%), with positive free cash flow of $1.0 billion (gevernova.com, October 23, 2024 - *older*). Q4 2024 continued this trend with record orders of $13.2 billion (+22% organically) and revenue of $10.6 billion (+5%), alongside $0.6 billion in free cash flow (gevernova.com, *older*).

News context highlights strategic moves and market tailwinds. GE Vernova is actively enhancing its offerings, as evidenced by its acquisition of France's Alteia to boost AI tools for utilities (reuters.com, July 21, 2025). The company also secured a maintenance order from Rio Tinto for hydropower plant upgrades (finance.yahoo.com, July 9, 2025), underscoring demand for its core services. Broader market sentiment suggests potential benefits from Fed rate cut signals (CNBC, August 23, 2025) and the growth of AI data centers (seekingalpha.com, May 27, 2025), which require significant energy infrastructure. However, the short interest on GEV stands at 2.50% of the float, with a 5.75% increase from the previous month (marketbeat.com, July 31, 2025), indicating some skepticism among investors.

While GE Vernova operates in a critical growth sector and exhibits strong cash flow and order growth, its current valuation multiples and high debt-to-equity ratio present significant concerns for a value investor seeking a substantial margin of safety."
CRWD,0.5,0.15,Sell,2025-08-27,"As of 2025-08-27, CrowdStrike Holdings, Inc. (CRWD) presents a highly speculative investment proposition, trading at a substantial $422.61 per share with a market capitalization of $105.33 billion, despite a glaring absence of GAAP profitability. The company's `null` trailing P/E ratio, coupled with a negative EV/EBITDA of -7840.023, unequivocally signals that CRWD is not generating positive earnings before interest, taxes, depreciation, and amortization, let alone net income, over the past year. This fundamental weakness is starkly contrasted by an astronomical forward P/E of 98.97, demanding near-flawless execution and sustained hyper-growth to justify its current valuation.

The market's skepticism is palpable today, with shares already down nearly 7% in after-hours trading to approximately $393 (cnbc.com, Aug 27, 2025), likely in anticipation of or immediate reaction to the Q2 2026 earnings call scheduled for this evening (finance.yahoo.com, Aug 27, 2025). This follows a significant 9% drop in March 2025 when CrowdStrike issued a ""disappointing earnings forecast"" for Q4 2025, with expected EPS falling well short of analyst estimates, and reported a net loss for the quarter (cnbc.com, Mar 4, 2025).

Further undermining confidence, the company disclosed in June 2025 that it received a ""request for information from the DOJ and the SEC relating to revenue recognition and reporting of ARR for certain transactions"" (fool.com, Jun 3, 2025). Regulatory scrutiny over key growth metrics like Annual Recurring Revenue (ARR) and revenue recognition is a severe risk for a company whose valuation is heavily reliant on these figures. The same report also highlighted a GAAP net loss of $110.2 million, which included $39.7 million in expenses related to a July 19 outage, indicating operational vulnerabilities and non-recurring costs impacting the bottom line. While operating cash flow is positive at $1.38 billion and free cash flow at $1.31 billion, these cash generation figures are insufficient to rationalize an exorbitant price-to-book ratio of 30.50, which implies an enormous premium for intangible assets and future prospects. Moreover, older reports from August 2024 (finance.yahoo.com, *older than 12 months*) already showed downward revisions to both revenue and earnings estimates for fiscal years 2025 and 2026, suggesting a persistent trend of tempered expectations.

Given the persistent GAAP unprofitability, extreme valuation multiples, recent earnings disappointments, and ongoing regulatory scrutiny, CrowdStrike's current market price appears to be built on an increasingly shaky foundation of future promises rather than present performance.","bloomberg.com, cnbc.com, cnn.com, finance.yahoo.com, fool.com, ir.crowdstrike.com, reuters.com, seekingalpha.com",28,18,"CrowdStrike presents an extremely high-risk profile due to its exorbitant valuation (forward P/E 98.97, P/B 30.50, negative EV/EBITDA) despite persistent GAAP unprofitability and recent net losses. A significant regulatory inquiry from the DOJ and SEC regarding revenue recognition and ARR reporting introduces severe uncertainty and risk to its core growth metrics. This is compounded by operational issues, a recent after-hours stock drop following Q2 earnings, and previous disappointing guidance, all indicating a lack of fundamental justification for its current market price.","As a market investor, my attention today, August 27, 2025, is sharply focused on CrowdStrike Holdings, Inc. (CRWD) following its Q2 2026 earnings call. While the stock closed up 1.20% at $422.61, it has experienced a significant after-hours drop of nearly 7% to $393.50 (cnbc.com), indicating a negative market reaction to the latest results or guidance.

CrowdStrike, a prominent player in the Technology sector, boasts a substantial market capitalization of $105.33 billion. Its current price of $422.61 sits below its 52-week high of $517.98 (achieved on July 3, 2025, per cnbc.com) but well above its 52-week low of $242.25 (from September 11, 2024, per cnbc.com). Valuation remains stretched, with a forward P/E ratio of 98.97 and a price-to-book ratio of 30.50. The trailing P/E ratio is N/A, and the EV/EBITDA is a deeply negative -7840.02, reflecting unprofitability on an EBITDA basis.

Despite these valuation concerns, CrowdStrike demonstrates robust cash generation, reporting operating cash flow of $1.38 billion and free cash flow of $1.31 billion. Capital expenditures are N/A. The balance sheet appears solid with a low debt-to-equity ratio of 22.50%, and no dividend yield is reported.

Recent news has introduced significant headwinds. The company's Q4 2025 earnings, reported on March 4, 2025 (cnbc.com, ir.crowdstrike.com), led to a 9% stock decline due to disappointing earnings guidance, despite beating revenue estimates with a 25% year-over-year increase to $1.06 billion. More critically, the Q1 2026 earnings transcript from June 3, 2025 (fool.com), revealed a GAAP net loss of $110.2 million, including $39.7 million in expenses related to a July 19 outage. Furthermore, the company disclosed a request for information from the DOJ and SEC concerning revenue recognition, ARR reporting, and the aforementioned outage, presenting a notable regulatory risk. Over the past 90 days leading up to August 27, 2024, revenue and earnings estimates for fiscal years 2025 and 2026 had already seen downward revisions (finance.yahoo.com, Aug 27, 2024, *older than 12 months*).

While the broader cybersecurity sector is viewed as a ""defensive"" investment resilient to economic downturns and increasing cyberthreats (finance.yahoo.com, April 30, 2025), and CNBC's Jim Cramer has expressed continued bullishness on the stock as recently as August 25 and 27, 2025, the immediate negative market reaction to today's Q2 2026 earnings call suggests that recent performance or future outlook has failed to impress.

Given the high valuation, ongoing net losses, a significant regulatory inquiry, and the immediate negative market reaction to today's earnings, CrowdStrike presents a high-risk, high-reward profile that demands careful monitoring of its profitability trajectory and the resolution of its legal and regulatory challenges.",0.8246841027780923,"As a value investor, my primary focus is on acquiring businesses at a discount to their intrinsic worth, emphasizing strong fundamentals, predictable earnings, and a margin of safety. Analyzing CrowdStrike Holdings, Inc. (CRWD) on 2025-08-27, the picture that emerges is one of a high-growth technology company whose valuation metrics present significant challenges for a value-oriented approach.

CrowdStrike's current market capitalization stands at $105.33 billion, with its stock trading at $422.61. From a valuation perspective, the company's metrics are exceptionally high. The forward Price-to-Earnings (P/E) ratio is 98.97, indicating that investors are paying nearly 100 times expected future earnings. The trailing P/E is explicitly stated as null, suggesting the company has not been consistently profitable on a GAAP basis over the last twelve months, a fact corroborated by news of a net loss in Q4 2025 (cnbc.com, March 4, 2025) and a GAAP net loss of $110.2 million in Q1 2026 (The Motley Fool, June 3, 2025). The Price-to-Book ratio is an astonishing 30.50, implying that the market values the company's assets far beyond their accounting value, likely due to intangible assets and growth expectations. Furthermore, the Enterprise Value (EV) to EBITDA is a negative -7840.02, which signals negative EBITDA and further underscores a lack of traditional profitability.

Despite these concerning valuation multiples, CrowdStrike does demonstrate strong cash flow generation. The company reported operating cash flow of $1.38 billion and free cash flow of $1.31 billion, which is a positive sign for a growth company, indicating it is not burning cash. Debt-to-Equity is a manageable 22.498, suggesting a relatively healthy balance sheet in terms of leverage.

However, recent news introduces significant uncertainty. CrowdStrike's shares fell 9% in March 2025 after issuing ""disappointing earnings guidance"" for Q4 2025, with expected EPS falling short of LSEG estimates (cnbc.com, March 4, 2025). While revenue grew 25% year-over-year to $1.06 billion and annual recurring revenue (ARR) reached $4.24 billion, the market's reaction highlights the high expectations priced into the stock. More critically, the Q1 2026 earnings transcript (The Motley Fool, June 3, 2025) revealed that the company received a request for information from the DOJ and SEC regarding revenue recognition, ARR reporting, and a July 19 outage. This regulatory scrutiny, coupled with $39.7 million in expenses related to the outage, introduces a substantial element of risk and uncertainty regarding the reliability of reported financials and future operational stability. While the cybersecurity sector is often touted as a ""defensive"" investment (finance.yahoo.com, April 30, 2025), this does not negate the individual company's valuation or specific risks.

From a value investor's standpoint, CrowdStrike's current valuation is exorbitantly high, lacking the fundamental profitability and margin of safety typically sought, and is further complicated by regulatory inquiries and past operational issues."
