Ticker,Agent_Confidence,Agent_Rating,Agent_Recommendation,Analysis_Date,Devils_Advocate_Analysis,Domains_Used,Evidence_Total,Evidence_Used,Justification,Market_Investor_Analysis,Quant_Score,Value_Investor_Analysis
NVDA,0.75,0.25,Sell,2025-08-27,"As of 2025-08-27, NVIDIA Corporation (NVDA) presents a fascinating, albeit precarious, picture for the discerning investor. While the market cap stands at an astounding $4.43 trillion and the stock price at $181.60, hovering near its 52-week high of $184.48, a closer look reveals significant red flags that the bullish narrative often glosses over.

From a fundamental perspective, NVIDIA's valuation multiples are nothing short of stratospheric. The trailing P/E ratio of 58.39 and a forward P/E of 44.08 suggest that an immense amount of future growth is already priced in, leaving little room for error. The price-to-book ratio of 52.82 further underscores this extreme valuation, indicating that investors are paying an exorbitant premium far beyond the company's tangible assets. While operating cash flow is robust at $64.09 billion and free cash flow at $55.44 billion, the question remains whether even these impressive figures can sustain such a lofty market capitalization. Capital expenditures are N/A. The dividend yield is a negligible 0.02%, offering no solace for income-focused investors. The EV/EBITDA multiple of 49.767 reinforces the narrative of an overextended valuation.

The latest news context, particularly today's earnings announcement, provides immediate cause for concern. CNBC.com, just minutes ago, reported ""Nvidia sales drop more than 4% as chipmaker says no Q2 H20 sales to China-based customers."" This is a critical blow, directly impacting the company's top line and highlighting the tangible effects of geopolitical tensions. Reuters (Aug 19, 2025) noted NVIDIA's efforts to develop new AI chips for China to circumvent restrictions, but the current sales drop confirms these workarounds are not yet fully mitigating the impact. This follows earlier sentiment, as seen in a Yahoo Finance article (Mar 7, 2025, *older than 12 months*), questioning why NVDA was ""Plunging So Far in 2025"" due to ""tariff and AI-related fears.""

Furthermore, the stock's meteoric rise—a 171% surge in 2024 and another 25% gain so far in 2025 (finance.yahoo.com, Aug 6, 2025)—has cultivated a sense of euphoria, which Seeking Alpha (Jul 14, 2025) explicitly noted as a contrarian warning sign, suggesting valuation is ""no longer attractive."" The market's dependence on NVIDIA to ""gauge the sustainability of the broader tech and artificial intelligence trade"" (cnbc.com, Aug 28, 2024, *older than 12 months*) means any stumble from the chipmaker could have wider repercussions, amplifying downside risk.

In conclusion, despite its undeniable technological prowess and strong cash generation, NVIDIA's current valuation is precariously high, and recent earnings news of a sales drop due to China restrictions introduces a significant crack in its seemingly impenetrable growth story.","bloomberg.com, cnbc.com, finance.yahoo.com, investor.nvidia.com, nvidianews.nvidia.com, reuters.com, seekingalpha.com",28,18,"NVIDIA's valuation remains stratospheric across all metrics (P/E 58.39, P/B 52.82, EV/EBITDA 49.77), indicating immense future growth is already priced in. The Q2 FY2026 earnings report confirmed a significant sales drop exceeding 4% due to the absence of H20 chip sales to China, a direct materialization of geopolitical risks. This immediate negative catalyst, combined with the extreme valuation, creates a precarious outlook and an insufficient margin of safety, despite the company's strong cash flow and AI leadership.","NVIDIA Corporation (NVDA) continues to command a dominant position in the technology sector, reflected by its colossal market capitalization of $4.43 trillion. As of today, August 27, 2025, the stock trades at $181.60, hovering near its 52-week high of $184.48. The company's valuation metrics remain elevated, with a trailing P/E of 58.39 and a forward P/E of 44.08, alongside a price-to-book ratio of 52.82 and an EV/EBITDA of 49.77, all indicative of significant growth expectations. Fundamentally, NVIDIA demonstrates robust financial health, boasting a manageable debt-to-equity ratio of 12.27% and strong operating cash flow of $64.09 billion, translating into a substantial free cash flow of $55.44 billion; capital expenditures are not provided.

Today's market attention is squarely on NVIDIA's Q2 Fiscal 2026 earnings, which were announced after market close. Initial after-hours trading indicates a negative market reaction, with the stock declining to approximately $175.38 (-3.43%) (cnbc.com) and $176.22 (-2.96%) (finance.yahoo.com). A significant factor contributing to this sentiment appears to be the reported ""sales drop more than 4% as chipmaker says no Q2 H20 sales to China-based customers"" (cnbc.com), highlighting the impact of ongoing geopolitical tensions. While Reuters (Aug 19, 2025) noted NVIDIA is ""working on new AI chip for China that outperforms"" previous restricted models, the immediate sales impact is a clear headwind.

Despite a strong year-to-date gain of 35.23% (cnbc.com), some analysts have expressed concerns about valuation, with a July 14, 2025, Seeking Alpha article stating that ""Nvidia Corporation's valuation is no longer attractive after a massive run, with sentiment shifting from panic to euphoria."" This echoes earlier sentiments from August 28, 2024 (cnbc.com, *older article*), questioning the sustainability of its rally. Nevertheless, NVIDIA remains the ""backbone of the artificial intelligence (AI) revolution"" (finance.yahoo.com, Aug 6, 2025), with its GPUs being indispensable for generative AI, autonomous vehicles, and data-driven cloud infrastructure.

The immediate post-earnings dip, driven by concerns over China sales and its premium valuation, suggests that while NVIDIA's long-term position in the AI landscape is undeniable, its stock faces increased scrutiny as growth expectations are tested by geopolitical realities.",0.8226397503871147,"As of August 27, 2025, NVIDIA Corporation (NVDA) presents a complex picture for a value investor, balancing its undeniable leadership in the burgeoning AI sector against a valuation that suggests substantial future growth is already priced in.

From a fundamental perspective, NVIDIA demonstrates robust financial health in certain areas. The company boasts significant operating cash flow of $64.09 billion and free cash flow of $55.44 billion, indicating strong cash generation capabilities. Its debt-to-equity ratio is a manageable 12.267. However, capital expenditures are not provided in the available data.

The primary concern for a value investor lies squarely in NVIDIA's valuation multiples. With a market capitalization of $4.43 trillion and a current price of $181.60, the stock trades at a trailing P/E of 58.39 and a forward P/E of 44.08. The price-to-book ratio stands at an exceptionally high 52.82, and the EV/EBITDA is 49.77. These figures are indicative of a company priced for aggressive growth, leaving little room for error or unexpected headwinds. The stock is also trading near its 52-week high of $184.48, having surged significantly in prior years (e.g., 171% in 2024 and 25% year-to-date in 2025, according to finance.yahoo.com on August 6, 2025).

Recent news provides critical context. Today, August 27, 2025, NVIDIA announced its Q2 Fiscal 2026 financial results. CNBC.com reports that ""Nvidia sales drop more than 4% as chipmaker says no Q2 H20 sales to China-based customers."" This direct impact from geopolitical tensions and export restrictions on sales to China is a significant risk factor that has materialized, despite earlier reports (Reuters, August 19, 2025) of NVIDIA working on new AI chips for China. This sales decline, coupled with the company's high valuation, could lead to a re-evaluation of its growth trajectory. While NVIDIA remains central to the ""AI revolution"" (finance.yahoo.com, August 6, 2025), the market has shown signs of cooling off for big-cap tech stocks earlier in 2025, with the S&P 500 down 1.5% year-to-date by March 7, 2025 (finance.yahoo.com). Sentiment has also been described as shifting from ""panic to euphoria"" (seekingalpha.com, July 14, 2025), which often precedes a contrarian view for value investors.

Given the extremely high valuation multiples and the immediate negative news regarding a sales drop and China export restrictions impacting Q2 FY2026 results, NVIDIA's current price offers an insufficient margin of safety for a value investor."
VST,0.5,0.25,Sell,2025-08-27,"Vistra Corp. (VST) has certainly captured market attention, riding a wave of enthusiasm that has propelled its stock from a 52-week low of $72.90 to its current $194.60, nearing its $216.85 high. Recent analyst endorsements from Morgan Stanley and Rebecca Walser (cnbc.com, August 2025) highlight perceived momentum in nuclear power and AI-driven demand, following strong Q3 2024 and Q4 2024 earnings (finance.yahoo.com, January and March 2025).

However, a closer look reveals a valuation that borders on speculative. With a trailing P/E of 31.286 and a forward P/E of 28.2029, Vistra is priced for perfection, far exceeding typical utility multiples. The Price-to-Book ratio of 28.117325 is particularly egregious, suggesting an extreme premium over its tangible assets. Furthermore, the company's financial structure carries significant risk, evidenced by a staggering Debt-to-Equity ratio of 373.842. While operating cash flow stands at a healthy $4.563 billion and free cash flow at $1.735 billion, this high leverage could become problematic if market conditions shift or interest rates rise.

The narrative around AI-driven power demand, while compelling, faces tangible headwinds. Despite securing solar PPAs with tech giants, the Federal Energy Regulatory Commission's rejection of a key agreement for the Susquehanna nuclear plant to dispatch more power to an Amazon data center (cnbc.com, 2024-11-04, an article older than 12 months) demonstrates that regulatory hurdles for nuclear expansion are very real. This rejection directly contradicts the ""nuclear power gaining momentum"" thesis and could limit Vistra's ability to fully capitalize on the AI boom. The explicit mention of ""buy the rumor, sell the news"" sentiment regarding AI stocks (finance.yahoo.com, March 2025) further suggests that much of the potential upside may already be baked into the current share price. Lastly, the absence of a reported `capitalExpenditures` figure makes a comprehensive assessment of its investment efficiency and true free cash flow generation challenging.

In conclusion, while Vistra has enjoyed a remarkable run fueled by AI and nuclear optimism, its sky-high valuation and substantial debt load, coupled with demonstrated regulatory friction for its growth initiatives, present considerable downside risk.","bloomberg.com, cnbc.com, finance.yahoo.com, investor.vistracorp.com, marketbeat.com, reuters.com, seekingalpha.com, vistracorp.com, wsj.com",28,18,"Vistra Corp. presents a highly speculative investment profile. Despite strong operational cash flow and tailwinds from AI-driven power demand and nuclear energy, its valuation metrics are exceptionally stretched, with a trailing P/E of 31.29 and an egregious price-to-book ratio of 28.12. The company carries a substantial debt load (D/E of 373.84), and regulatory hurdles, such as the FERC rejection of a key power dispatch request, pose significant risks to growth initiatives. The absence of capital expenditure data further complicates a comprehensive financial assessment. Given the extreme premium, high leverage, and demonstrated regulatory friction, the downside risk is considerable, making it an uncompelling investment despite some positive catalysts.","As of 2025-08-27, Vistra Corp. (VST) trades at $194.60, reflecting a substantial market capitalization of $65.93 billion within the Utilities sector. The company's valuation metrics are quite elevated, with a trailing P/E of 31.29 and a forward P/E of 28.20, indicating the market is pricing in significant future growth. The price-to-book ratio stands at an exceptionally high 28.12, which is atypical for a utility and warrants close scrutiny. Vistra also carries a considerable debt load, evidenced by its debt-to-equity ratio of 373.84. While operating cash flow is robust at $4.56 billion and free cash flow is $1.74 billion, the critical metric of capital expenditures is explicitly missing from the provided data, making a comprehensive assessment of cash flow quality challenging. The dividend yield is a modest 0.46%, suggesting a focus on reinvestment rather than income distribution.

Vistra's stock has demonstrated impressive momentum, trading near its 52-week high of $216.85, a significant climb from its 52-week low of $72.90. This performance is largely underpinned by the surging demand for power from AI data centers, with Vistra reportedly securing major solar PPAs with Amazon and Microsoft (Yahoo Finance, January 30, 2025; March 1, 2025). The company has also received positive attention from analysts, with Morgan Stanley (CNBC, August 18, 2025) and Rebecca Walser (CNBC, August 7, 2025) recommending Vistra, citing the growing momentum for nuclear power. Vistra reported strong Q3 2024 earnings with $1.85 billion net income and reaffirmed its 2025 guidance (Yahoo Finance, January 30, 2025; March 1, 2025).

However, the investment landscape for Vistra is not without significant risks. A notable setback occurred when the Federal Energy Regulatory Commission (FERC) rejected a request to increase power dispatch from the Susquehanna nuclear plant to an Amazon data center campus (CNBC, November 4, 2024, *article older than 12 months*). This decision was seen as a major roadblock for the integration of AI data centers with nuclear power and led to a decline in VST's stock alongside its peers. Furthermore, while some investors view Vistra as a ""Great Volatility Hedge"" (Seeking Alpha, May 11, 2025), others have observed that a ""Deep Selloff Is Well Warranted"" (Seeking Alpha, March 4, 2025), highlighting the stock's inherent volatility and sensitivity to market sentiment.

Given the high valuation, substantial debt, and regulatory hurdles despite strong tailwinds from AI-driven power demand and nuclear energy momentum, Vistra Corp. represents a high-growth, high-risk investment opportunity within the utility sector.",0.7803431111093934,"As of August 27, 2025, Vistra Corp. (VST), operating in the Utilities sector, presents a mixed picture for a value investor, characterized by strong operational performance and significant growth catalysts, yet burdened by a stretched valuation and substantial leverage.

Vistra's current stock price of $194.60 sits closer to its 52-week high of $216.85 (CNBC, August 2025), reflecting considerable market enthusiasm. The company commands a market capitalization of $65.93 billion. From a valuation perspective, Vistra's trailing P/E ratio of 31.286175 and forward P/E of 28.2029 are elevated for a traditional utility, suggesting that the market is pricing in significant future growth. The price-to-book ratio of 28.117325 is exceptionally high, and the EV/EBITDA multiple stands at 12.915, both indicating a premium valuation that typically deters a value-oriented approach.

Operationally, Vistra demonstrates robust cash generation, reporting an operating cash flow of $4.563 billion and free cash flow of $1.735 billion. However, capital expenditures is N/A, which is a crucial missing metric for a comprehensive free cash flow analysis. A significant concern for a value investor is the company's high debt-to-equity ratio of 373.842%, indicating substantial financial leverage that could pose risks, particularly in a rising interest rate environment or economic downturns. The dividend yield is a modest 0.46%.

Recent news highlights Vistra's strategic positioning to capitalize on the burgeoning demand for AI-driven power. The company reported strong Q4 earnings and reaffirmed its 2025 guidance in March 2025 (Yahoo Finance), attributing this to AI-driven power demand. Furthermore, Vistra delivered strong Q3 2024 earnings with $1.85 billion net income and secured major solar Power Purchase Agreements (PPAs) with Amazon and Microsoft in January 2025 (Yahoo Finance). Industry experts, including Morgan Stanley and Rebecca Walser, have recommended Vistra, citing the growing momentum in nuclear power (CNBC, August 2025), a segment in which Vistra is a key player.

However, the path is not without obstacles. In November 2024 (CNBC), the Federal Energy Regulatory Commission (FERC) rejected a request to increase power dispatch from the Susquehanna nuclear plant to an Amazon data center, causing a notable dip in Vistra's stock. This event, while older than 12 months, underscores the regulatory risks inherent in large-scale energy projects, even those aligned with high-growth sectors like AI.

Given its elevated valuation multiples, particularly the exceptionally high price-to-book ratio, and significant financial leverage, Vistra Corp. does not currently present itself as a compelling value investment opportunity, despite its strong operational performance and favorable industry tailwinds from AI-driven power demand."
