Ticker,Agent_Confidence,Agent_Rating,Agent_Recommendation,Analysis_Date,Devils_Advocate_Analysis,Domains_Used,Evidence_Total,Evidence_Used,Justification,Market_Investor_Analysis,Quant_Score,Value_Investor_Analysis
PLTR,0.75,0.45,Neutral,2025-08-27,"Palantir Technologies Inc. (PLTR) has undeniably delivered impressive financial results and market performance, with its stock price soaring to $156.72, a staggering 107.22% year-to-date and 413.88% over the last year (cnbc.com, finance.yahoo.com). The company's Q2 2025 earnings, reported on August 5, 2025 (finance.yahoo.com), showcased record revenue surpassing $1 billion, a 48% year-over-year growth, with US commercial revenue up 93% year-over-year. Adjusted operating margin expanded to 46%, and adjusted free cash flow hit $569 million, representing a robust 57% margin. These figures, alongside Q3 2025 revenue guidance of $1.083 billion to $1.087 billion, paint a picture of a rapidly expanding enterprise leveraging the AI narrative.

However, a closer look reveals a valuation that demands not just perfection, but a sustained, unprecedented level of hyper-growth for years to come. With a market capitalization of $371.79 billion, Palantir trades at an astronomical trailing P/E of 505.5484 and a forward P/E of 333.4468. Its price-to-book ratio stands at an eye-watering 62.688, and the EV/EBITDA multiple is an equally dizzying 628.935. These multiples suggest that every conceivable future success, and then some, is already baked into the current share price.

While operating cash flow is a healthy $1,153,865,000 and free cash flow is $1,269,297,536, and debt-to-equity is a manageable 3.947, these strong fundamentals are dwarfed by the valuation premium. The market's reaction to Q1 2025 earnings on May 5, 2025 (cnbc.com) serves as a stark warning: despite meeting EPS estimates and *lifting* full-year guidance, shares fell approximately 9%. This indicates an investor base with insatiable expectations, where anything less than a blowout beat, even if fundamentally positive, is met with selling pressure.

The narrative of Palantir as the ""operating system for the modern enterprise in the era of AI"" (CEO Alex Karp, cnbc.com, May 5, 2025) has undoubtedly fueled much of this rally, attracting significant retail interest and leading to ""sentiment-driven breakout[s]"" (seekingalpha.com, Aug 10, 2025). This reliance on narrative and retail momentum, rather than a grounded assessment of value, introduces significant speculative risk. The stock's current price of $156.72 is uncomfortably close to its 52-week high of $190.00, having surged from a low of $29.31, suggesting that much of the easy money has already been made. Furthermore, the absence of a dividend yield (N/A) and explicit capital expenditures data (N/A) means investors are purely betting on future appreciation driven by growth that must continually exceed already sky-high expectations.

Despite impressive recent growth and profitability, Palantir's stratospheric valuation, driven by an unforgiving market and AI hype, leaves virtually no room for error and presents an exceptionally high-risk proposition for new investors.","barrons.com, bloomberg.com, cnbc.com, cnn.com, finance.yahoo.com, nasdaqtrader.com, reddit.com, reuters.com, seekingalpha.com",28,18,"Palantir demonstrates exceptional operational performance, with robust revenue growth, expanding profitability, and strong free cash flow, particularly driven by its AI-powered U.S. commercial segment. However, all three reports highlight the company's extraordinarily high valuation metrics (P/E, P/B, EV/EBITDA), which price in an unprecedented level of future growth and leave virtually no margin of safety. While the Market Investor views the premium as justified by growth, the Value Investor and Devil's Advocate strongly caution against the speculative risk and insatiable market expectations, making it an exceptionally high-risk proposition for new investors. The conflicting views, balanced against the undeniable operational strength and extreme valuation, lead to a Neutral stance.","As a Market Investor, Palantir Technologies Inc. (PLTR) presents a fascinating, high-growth, high-valuation case in the Technology sector. The company currently trades at $156.72, commanding a substantial market capitalization of $371.79 billion.

Palantir has demonstrated impressive financial momentum, particularly highlighted by its recent Q2 2025 earnings report on August 5, 2025 (GuruFocus News). The company surpassed $1 billion in total revenue for the quarter, marking a robust 48% year-over-year growth. Its critical U.S. business revenue surged 68% year-over-year, with U.S. Commercial revenue leading the charge at a remarkable 93% year-over-year increase and representing 31% of Q2 revenue. U.S. Government revenue also grew significantly at 53% year-over-year. This strong top-line performance is complemented by increasing profitability, with an adjusted operating margin expanding to 46% and adjusted free cash flow reaching $569 million, representing a 57% margin. GAAP net income was $327 million, or $0.13 per share. Operating cash flow is a healthy $1.15 billion, contributing to a strong free cash flow of $1.27 billion; capital expenditures are not provided, and the company does not offer a dividend yield. Palantir also expanded its customer count by 43% year-over-year to 849 customers and increased net dollar retention to 128%. Earlier in the year, Q4 2024 earnings (cnbc.com, Feb 3, 2025) saw shares rocket 22% after the company posted better-than-expected results and outlook, while Q1 2025 earnings (cnbc.com, May 5, 2025) met expectations and lifted full-year guidance, despite a slight share dip. CEO Alex Karp's vision of Palantir delivering ""the operating system for the modern enterprise in the era of AI"" (cnbc.com, May 5, 2025) clearly resonates, as PLTR shares have defied broader tech downtrends in 2025.

Despite this robust growth, Palantir's valuation metrics remain exceptionally high, reflecting significant market expectations for continued aggressive expansion. Its trailing P/E stands at 505.55, with a forward P/E of 333.45, and a price-to-book ratio of 62.69. The enterprise value to EBITDA (EV/EBITDA) is also elevated at 628.94. The stock has experienced considerable volatility, trading within a 52-week range from a low of $29.31 to a high of $190.00, which was reached recently on August 12, 2025 (cnbc.com). The strong AI narrative and consistent revenue beats have fueled considerable investor interest, with retail investors showing strong engagement and contributing to ""sentiment-driven breakouts"" (seekingalpha.com, Aug 10, 2025).

Palantir's impressive revenue growth and profitability, particularly in its AI-driven U.S. commercial segment, justify its premium valuation, making it a compelling, albeit high-expectation, growth play in the current market.",0.8494749859205687,"As a value investor, my analysis of Palantir Technologies Inc. (PLTR) on 2025-08-27 reveals a company with compelling operational momentum but an exceptionally challenging valuation.

Palantir has demonstrated impressive financial performance in its recent earnings reports. For Q4 2024 (published Feb 3, 2025), the company surpassed analyst estimates for both earnings and revenue, leading to a significant stock surge (cnbc.com). This positive trend continued into Q1 2025 (published May 5, 2025), where Palantir met EPS expectations, beat revenue estimates, and raised its full-year guidance, attributing success to the adoption of its AI software (cnbc.com). Most recently, the Q2 2025 earnings call highlights (published Aug 5, 2025, finance.yahoo.com) show remarkable growth: total revenue surpassed $1 billion, growing 48% year-over-year, with US commercial revenue surging 93% year-over-year. The company reported GAAP net income of $327 million (33% margin) and adjusted free cash flow of $569 million (57% margin) for the quarter, ending with $6 billion in cash and equivalents. These figures indicate strong operational execution, increasing profitability, and robust cash generation, driven by its strategic positioning as an ""operating system for the modern enterprise in the era of AI.""

However, from a value investing perspective, the current valuation metrics are a significant deterrent. Palantir's market capitalization stands at $371.79 billion, with a share price of $156.72. The trailing P/E ratio is an astronomical 505.55, and the forward P/E is still an extremely high 333.45. The price-to-book ratio is 62.69, and the EV/EBITDA is 628.94. While the company's debt-to-equity ratio is a healthy 3.947, and it generates substantial free cash flow ($1.27 billion canonically, with Q2 2025 alone showing $569 million), these high multiples suggest that an extraordinary amount of future growth is already priced into the stock. The stock has seen a historic rally, with a 1-year change of 413.88% and a year-to-date change of 107.22% (finance.yahoo.com), trading near its 52-week high of $190.00. This rapid appreciation, coupled with positive retail sentiment (seekingalpha.com), indicates a market that is highly enthusiastic about Palantir's prospects, particularly in AI.

Despite Palantir's impressive growth, GAAP profitability, and strong free cash flow generation, its current valuation metrics are exceptionally elevated, offering no discernible margin of safety for a value investor."
AVGO,0.75,0.4,Neutral,2025-08-27,"Broadcom Inc. (AVGO) currently trades at a price of $300.25, near its 52-week high of $317.35 reached on August 13, 2025 (CNBC), reflecting a substantial 29.51% year-to-date gain (CNBC). However, a closer look at its fundamentals reveals a company priced for perfection, with a trailing P/E of 109.58 and a forward P/E of 48.66, both indicating aggressive growth expectations are already baked into the valuation. The price-to-book ratio of 5.07 further suggests a significant premium over its net asset value.

While Broadcom generates robust operating cash flow of $19.96 billion and free cash flow of $26.15 billion, its debt-to-equity ratio stands at a considerable 166.032, introducing substantial financial leverage risk. Capital expenditures are explicitly null in the provided data. The dividend yield is a modest 0.79%, offering little cushion against potential capital depreciation.

The stock's impressive run-up from its 52-week low of $134.90 to its current levels has seemingly erased earlier concerns. As recently as March 7, 2025, Yahoo Finance (older than 12 months) questioned ""Why Broadcom Inc. (AVGO) Is Plunging So Far in 2025?"", attributing the decline to ""tariff and AI-related fears"" and investors ""souring"" on big-cap tech investments. While the stock has since recovered, this prior sentiment weakness, also noted by Seeking Alpha on February 23, 2025 (older than 12 months), highlights the stock's susceptibility to market shifts. The current flurry of positive analyst calls (CNBC, August 25-26, 2025) and articles touting AI's transformative impact (Seeking Alpha, January 3, 2025, older than 12 months) could be indicative of peak hype, rather than a sustainable foundation for continued outperformance, especially given the ""cautious optimism"" for the broader market in 2025 (Yahoo Finance, January 29, 2025, older than 12 months). The recent partnership with Canonical (Broadcom News, August 26, 2025) is a positive development, but its impact may already be fully reflected in the elevated share price.

Despite strong cash flow, Broadcom's sky-high valuation, significant debt, and a history of recent volatility suggest that current investors are betting heavily on flawless execution and continued market euphoria, making it vulnerable to any shift in sentiment or economic headwinds.","bloomberg.com, broadcom.com, cnbc.com, finance.yahoo.com, investors.broadcom.com, news.broadcom.com, reuters.com, seekingalpha.com, wsj.com",28,18,"Broadcom demonstrates strong cash flow generation and strategic positioning in high-growth areas like AI and cloud infrastructure, bolstered by recent partnerships and positive analyst sentiment. However, these positives are significantly overshadowed by an extremely high valuation (trailing P/E 109.58, forward P/E 48.66, P/B 5.07) and a substantial debt-to-equity ratio of 166.032%. The stock is trading near its 52-week high, suggesting that significant future growth is already priced in, leaving a limited margin of safety for investors. This 'priced for perfection' scenario, coupled with considerable financial leverage, makes the stock vulnerable to market shifts or any failure to meet aggressive growth expectations.","As of 2025-08-27, Broadcom Inc. (AVGO) presents a compelling, albeit complex, picture for investors, balancing strong growth momentum with elevated valuation metrics. The stock closed at $300.25, near its 52-week high of $317.35, which was reached on August 13, 2025 (CNBC). This represents a significant recovery, as earlier in the year, a March 7, 2025 Yahoo Finance article noted AVGO was ""plunging so far in 2025"" amid broader market cooling and ""AI-related fears."" However, the stock has since rebounded strongly, boasting a year-to-date gain of 29.53% and an impressive 86.07% over the past year (Yahoo Finance).

Broadcom's market capitalization stands at a robust $1.412 trillion. From a valuation perspective, the company's trailing P/E ratio is 109.58, while its forward P/E is 48.66. Both figures are high, suggesting significant growth expectations are priced into the stock, though the substantial drop in forward P/E indicates anticipated strong earnings growth. The price-to-book ratio is 5.07, which is typical for a technology company with substantial intangible assets.

Financially, Broadcom demonstrates strong cash generation with an operating cash flow of $19.962 billion and free cash flow of $26.148 billion. Capital expenditures are N/A in the provided data. The company's debt-to-equity ratio is 166.032%, indicating a notable reliance on debt financing. Despite this, the enterprise value (EV) of $151.86 billion relative to its EV/EBITDA of 4.881 suggests efficient operational earnings when considering the entire capital structure. Broadcom also offers a dividend yield of 0.79%.

Recent news highlights Broadcom's strategic moves, particularly its expanded partnership with Canonical, announced on August 26, 2025 (news.broadcom.com). This collaboration aims to optimize VMware Cloud Foundation for modern container and AI workloads, leveraging the VMware acquisition to accelerate cloud-native innovation. This aligns with earlier Seeking Alpha articles from January and February 2025 (older than ~12 months) discussing how AI will redefine Broadcom and the competitive edge of CEO Hock Tan's leadership. Analyst sentiment appears positive, with CNBC reporting AVGO among ""Tuesday's biggest analyst calls"" on August 26, 2025, and UBS recommending AVGO as an ""outperforming stock with room to run"" on August 23, 2025.

Despite its high valuation multiples and significant debt, Broadcom's strong cash flow generation and strategic focus on high-growth areas like AI and cloud infrastructure, particularly through its VMware integration, position it as a key player in the technology sector.",0.7735828892656866,"As of 2025-08-27, Broadcom Inc. (AVGO), a technology sector leader with a substantial market capitalization of $1.412 trillion, is trading at $300.25. The stock has experienced significant appreciation, currently sitting near its 52-week high of $317.35, reached on August 13, 2025, and well above its 52-week low of $134.90 from September 9, 2024. Year-to-date, AVGO has gained 29.51% (CNBC, Yahoo Finance).

From a value investor's perspective, Broadcom's valuation metrics suggest a premium. The trailing P/E ratio is a very high 109.58, and the forward P/E is 48.66, both indicating that substantial future growth is already priced into the stock. The price-to-book ratio of 5.07 further supports this premium valuation. While the EV/EBITDA of 4.881 appears relatively low, this must be considered in the context of the company's capital structure.

Broadcom's financial health presents a mixed picture. The company demonstrates robust cash generation, with operating cash flow at $19.962 billion and free cash flow at an impressive $26.149 billion. However, a significant concern for a value investor is the high debt-to-equity ratio of 166.032, which indicates a heavily leveraged balance sheet. Capital expenditures are explicitly missing from the provided data. The dividend yield is a modest 0.79%.

Recent news highlights Broadcom's strategic activities and market sentiment. On August 26, 2025, Broadcom announced an expanded partnership with Canonical to optimize VMware Cloud Foundation for modern container and AI workloads, a positive operational development (news.broadcom.com). Analyst calls from CNBC on August 25-26, 2025, and a UBS recommendation on August 23, 2025, suggest a generally positive outlook on the stock. Earlier in the year, sentiment was more varied, with some articles questioning why AVGO was ""plunging"" in early 2025 due to market cooling and AI-related fears (finance.yahoo.com, March 7, 2025), while others considered it a ""best American stock to buy and hold"" (finance.yahoo.com, January 29, 2025).

Given the high valuation multiples and significant debt, despite strong cash flow generation and positive recent operational news, Broadcom Inc. appears to offer a limited margin of safety for a value investor at its current price."
